{
	"schemaVersion": "equipment-rank-first-revision-assignment-v3",
	"assignmentId": "revision-assignment-material-equipment-v3-spellweave-robes-torso-v3-attempt-4",
	"targetId": "material-equipment-v3-spellweave-robes-torso-v3",
	"attempt": 4,
	"immutable": true,
	"baseAssignment": {
		"path": "assets/equipment/experiments/material-equipment-v3/assignments/c/spellweave/robes-torso-v3.json",
		"canonicalSha256": "e8b3e28a56ac5485016f1ecbf5319bddda69c2fa50f7e9dfce3fcbb2db13f4d0"
	},
	"materialBrief": {
		"path": "assets/equipment/experiments/material-equipment-v3/direction/material-briefs/c-spellweave.json",
		"canonicalSha256": "7fbcde76583b81683e9563ad00a17d82e0f298f0ee31177f2a0ac93174cb79a3"
	},
	"revisionSource": {
		"path": "assets/equipment/experiments/material-equipment-v3/candidates/c/spellweave/robes-torso-v3.png",
		"sha256": "7e6fdd275fb33906dd4df1bf44c6278bd112030690c107a89591aad6eb33fb1b",
		"purpose": "First-pass Armour-piece candidate retained as immutable evidence; correct only the stated review issue."
	},
	"references": [
		{
			"path": "assets/equipment/experiments/material-equipment-v3/candidates/c/spellweave/robes-full-set-v3.png",
			"sha256": "2583be932e05edf55d70caa5864f8441d172efa2882f101f62ef710a81e89448",
			"purpose": "Owner-accepted full Armour set; authoritative source for piece reconstruction."
		},
		{
			"path": "assets/equipment/experiments/material-equipment-v3/candidates/c/spellweave/robes-torso-v3.png",
			"sha256": "7e6fdd275fb33906dd4df1bf44c6278bd112030690c107a89591aad6eb33fb1b",
			"purpose": "First-pass Armour-piece candidate retained as immutable evidence; correct only the stated review issue."
		},
		{
			"path": "assets/equipment/experiments/material-equipment-v3/direction/class-progressions/robes-cloth-fibre-ranks-v3.png",
			"sha256": "3f982275114ec66f36a3d22a4a18da4cd39a0467804c6e07ecb5e470954b9c3c",
			"purpose": "Requires owner checkpoint 1 acceptance for rank escalation, silhouettes, finish, camera, and empty-set treatment."
		},
		{
			"path": "assets/equipment/experiments/material-vs-class-calibration-2026-09-02/approach-a-steel-material-cohort-v1.png",
			"sha256": "6749ad1a65b995f48b89b0c1c8c8ee051da145315f5fd60775803f691ad7b887",
			"purpose": "Accepted painterly finish and cross-class material-coherence reference; do not copy geometry."
		}
	],
	"classification": "class-rule-violation",
	"correction": "Construct the Spellweave Torso as one cropped sleeved wrap jacket. Use a plain open V neckline and one continuous nearly horizontal bottom hem immediately below the waist belt. No pointed, split, dangling, or skirt-like fabric may extend beneath that line. No collar, cowl, mantle, shoulder overlay, apron, lower panel, Legs, or Boots. Show broad empty background below the hem.",
	"prompt": "Render only the torso item from the accepted full set. Preserve its exact material, palette, silhouette language, trim, fastenings, wear, ornament, and slot boundary. Do not redesign it.\n\nCLASS DIRECTION: Cloth-led draped equipment comprising exactly Head, Torso, Legs, and Boots. Empty self-supporting full set in a consistent mild three-quarter front view; no mannequin, wearer, or black void figure. Use the accepted progression reference as the authoritative design for the C column while reconstructing it as a dedicated render. Preserve rank silhouette and distinctive structural cues; do not crop.\n\nMATERIAL BRIEF — Spellweave:\nPalette: Deep indigo, muted violet, charcoal, and narrow cyan-violet thread accents.\nValue: Dark rich folds with selective luminous stitching.\nSurface/wear: Fine resilient weave, precise hems, layered runic stitching, almost no fray.\nConstruction: Structured drape, geometric panels, inscribed borders, suspended-looking collars and cuffs.\nSupernatural behavior: A few stitched glyph paths emit a faint controlled light.\nNeutral secondary materials: Black leather, silver clasps, matte lining, and dark cord.\nNeighbor distinction: More self-structured and arcane than Layered Silk; less ethereal and nocturnal than Moonweave.\n\nOne isolated torso only; no other set pieces, body part, wearer, mannequin, or display stand.\n\nSTYLE/OUTPUT: premium realistic-painterly dark fantasy equipment inventory art; grounded construction; honest material response; cold key light, restrained warm rim, midnight-charcoal studio ground with restrained floor plane. One fully visible object centered on a 1024×1024 portrait-or-square canvas, about 8% margin and never below 5%; readable at 128px. No text, labels, UI, border, watermark, signature, scenery, extra objects, hands, wielder, detached particles, uncontrolled glow, or recognizable reference copying.\n\nThe accepted full-set source is the first and authoritative visual reference. Match it exactly.\n\nREVISION PASS 4. The attached first-pass piece candidate is immutable evidence. Preserve every successful source-faithful trait while changing only the audited defect.\n\nCorrect this exact audited issue: Construct the Spellweave Torso as one cropped sleeved wrap jacket. Use a plain open V neckline and one continuous nearly horizontal bottom hem immediately below the waist belt. No pointed, split, dangling, or skirt-like fabric may extend beneath that line. No collar, cowl, mantle, shoulder overlay, apron, lower panel, Legs, or Boots. Show broad empty background below the hem.\n\nThe owner-accepted full set remains the first and authoritative reference. Return one new isolated torso candidate only. Do not make unrelated redesigns, add another Armour slot, add a body or mannequin, add text, or imitate recognizable copyrighted geometry.",
	"promptSha256": "1f256009218c17c3cf3e8befd7c643ffc52899bdd7449cb30f97fc906ac4aecf",
	"permittedOutputs": {
		"candidatePath": "assets/equipment/experiments/material-equipment-v3/revisions/material-equipment-v3-spellweave-robes-torso-v3/attempt-4/candidate.png",
		"resultPath": "assets/equipment/experiments/material-equipment-v3/revisions/material-equipment-v3-spellweave-robes-torso-v3/attempt-4/result.json"
	},
	"forbiddenActions": [
		"overwrite the first-pass Armour-piece candidate or result",
		"write outside the attempt-scoped Equipment v3 revision directory",
		"change another Armour slot or the owner-accepted full-set source",
		"promote a candidate to approved or runtime state",
		"edit shared catalogs, engine contracts, or another visual domain"
	]
}
